{
  "$schema": "https://cdf.epical.net/schemas/cdf-template.schema.json",
  "scope": "application",
  "name": "blank",
  "version": "v1",
  "release": "0.1.0",
  "description": "Blank application starter template. Deploys a resource group with feature-gated storage account and standard CDF tagging.",
  "providedFeatures": ["enableStorageAccount"],
  "dependencies": {
    "platform/blank/v1": {
      "release": ">=0.1.0",
      "requiredFeatures": ["enableStorageAccount"]
    }
  }
}
